{
  "protocol": "XIAOYA_RECORD_BUNDLE_V1",
  "schemaVersion": 1,
  "exportedAt": "2026-10-08T09:30:00.000Z",
  "studentCode": "student-01",
  "source": "cloud",
  "since": null,
  "sessionCount": 1,
  "sessions": [
    {
      "protocol": "FAMILY_LEARNING_SESSION_V1",
      "schemaVersion": 1,
      "sessionId": "session-20261008091200-a1b2c3d4",
      "lessonId": "lesson-20260924165323-family-six-after-review",
      "lessonTitle": "家庭六个新字 · 复习后",
      "lessonProtocol": "FAMILY_LEARNING_LESSON_V1",
      "basedOnLessonGeneratedAt": "2026-09-24T08:53:23.000Z",
      "activityMode": "test",
      "plannedNewHanziRefs": [],
      "plannedNewLetterRefs": [],
      "plannedNewMathRefs": [],
      "plannedNextPreviewHanziRefs": [],
      "startedAt": "2026-10-08T09:12:00.000Z",
      "endedAt": "2026-10-08T09:16:30.000Z",
      "completed": true,
      "stopReason": "completed",
      "lessonTaskCount": 2,
      "executedTaskCount": 2,
      "events": [
        {
          "eventId": "evt-0001",
          "recordedAt": "2026-10-08T09:12:20.000Z",
          "taskId": "test-hanzi-ZH-0001-1",
          "originalTaskId": "test-hanzi-ZH-0001-1",
          "subject": "hanzi",
          "targetRef": "ZH-0001",
          "targetDisplay": "人",
          "questionType": "choice",
          "evidenceType": "choice",
          "attempt": 1,
          "result": "correct",
          "independent": true,
          "hintUsed": false,
          "responseTimeMs": 2140,
          "childAnswer": "人",
          "correctAnswer": "人"
        },
        {
          "eventId": "evt-0002",
          "recordedAt": "2026-10-08T09:13:05.000Z",
          "taskId": "test-hanzi-ZH-0002-2",
          "originalTaskId": "test-hanzi-ZH-0002-2",
          "subject": "hanzi",
          "targetRef": "ZH-0002",
          "targetDisplay": "大",
          "questionType": "choice",
          "evidenceType": "choice",
          "attempt": 1,
          "result": "incorrect",
          "independent": false,
          "hintUsed": false,
          "responseTimeMs": 3320,
          "childAnswer": "太",
          "correctAnswer": "大"
        },
        {
          "eventId": "evt-0003",
          "recordedAt": "2026-10-08T09:13:08.000Z",
          "taskId": "test-hanzi-ZH-0002-2",
          "originalTaskId": "test-hanzi-ZH-0002-2",
          "subject": "hanzi",
          "targetRef": "ZH-0002",
          "targetDisplay": "大",
          "questionType": "choice",
          "evidenceType": "choice",
          "attempt": 1,
          "result": "hint_shown",
          "independent": false,
          "hintUsed": true,
          "responseTimeMs": 0,
          "childAnswer": "太",
          "correctAnswer": "大"
        },
        {
          "eventId": "evt-0004",
          "recordedAt": "2026-10-08T09:13:22.000Z",
          "taskId": "test-hanzi-ZH-0002-2",
          "originalTaskId": "test-hanzi-ZH-0002-2",
          "subject": "hanzi",
          "targetRef": "ZH-0002",
          "targetDisplay": "大",
          "questionType": "choice",
          "evidenceType": "choice",
          "attempt": 2,
          "result": "correct",
          "independent": false,
          "hintUsed": true,
          "responseTimeMs": 5100,
          "childAnswer": "大",
          "correctAnswer": "大"
        }
      ]
    }
  ]
}
